,instance_id,date,agenda,speechnumber,paragraphnumber,sentencenumber,speaker,party,text,parliament,iso3country,eu,policyarea,cmp_party,partyfacts
952847,952848,18/06/2013,Si riprende la discussione. (Dichiarazioni di voto finale – A.C. 1012-A),399,9,1,Sebastiano Barbanti,M5S,Il debito pubblico ha toccato nuovi record e la ripresa è ben lungi dal vedersi all'orizzonte.,IT-Parlamento,ITA,0,1,32956.0,2046.0
1097631,1097632,18/12/2013,"Discussione congiunta dei disegni di legge: Disposizioni per la formazione del bilancio annuale e pluriennale dello Stato (legge di stabilità 2014) (A.C. 1865-A); Bilancio di previsione dello Stato per l'anno finanziario 2014 e bilancio pluriennale per il triennio 2014-2016 (e relativa nota di variazioni) (Approvati dal Senato) (A.C. 1866-A) (ore 16,15) (Discussione congiunta sulle linee generali – A.C. 1865-A-1866-A)",89,4,1,Dorina Bianchi,NCD,"La necessità di non sforare la soglia del 3 per cento del rapporto debito/PIL, la rilevante evasione fiscale e l'enorme debito pubblico non hanno impedito al Governo di iniziare un percorso virtuoso – dico iniziare indubbiamente un percorso virtuoso – che affronta problemi immediati e porre le basi per la crescita futura del Paese, per la prima volta attraverso il taglio della spesa pubblica e attraverso la riduzione del deficit e delle tasse.",IT-Parlamento,ITA,0,1,,2052.0
502542,502543,15/07/2011,"Discussione del disegno di legge: S. 2814 - Conversione in legge, con modificazioni, del decreto-legge 6 luglio 2011, n. 98, recante disposizioni urgenti per la stabilizzazione finanziaria (Approvato dal Senato) (A.C. 4509) (ore 10,07). (Dichiarazioni di voto sulla questione di fiducia - Articolo unico - A.C. 4509)",86,3,3,Savino Pezzotta,UDC,"Come loro, stiamo affrontando, sia pure con grandezze molto diverse, la questione del debito pubblico; dobbiamo però rilevare una questione di metodo che qui non abbiamo trovato: l'amministrazione Obama sta affrontando la questione con una metodologia totalmente diversa da quella del Governo italiano.",IT-Parlamento,ITA,0,19,32610.0,201.0
1097881,1097882,18/12/2013,"Discussione congiunta dei disegni di legge: Disposizioni per la formazione del bilancio annuale e pluriennale dello Stato (legge di stabilità 2014) (A.C. 1865-A); Bilancio di previsione dello Stato per l'anno finanziario 2014 e bilancio pluriennale per il triennio 2014-2016 (e relativa nota di variazioni) (Approvati dal Senato) (A.C. 1866-A) (ore 16,15) (Discussione congiunta sulle linee generali – A.C. 1865-A-1866-A)",112,20,1,Vincenzo Garofalo,NCD,In primo luogo è necessario intervenire sul fronte crescita e sulla riduzione del debito pubblico.,IT-Parlamento,ITA,0,1,,2052.0
331777,331778,26/07/2010,Si riprende la discussione. (Ripresa discussione sulle linee generali - A.C. 3638),49,15,2,Gian Luca Galletti,UDC,Mi chiedo: qual è la risposta che stiamo dando con questa manovra al problema del debito pubblico?,IT-Parlamento,ITA,0,1,32610.0,201.0
332739,332740,26/07/2010,Si riprende la discussione. (Ripresa discussione sulle linee generali - A.C. 3638),86,3,5,Ivano Strizzolo,PD,Dico questo per sottolineare ancora una volta la natura del debito pubblico.,IT-Parlamento,ITA,0,1,32440.0,802.0
1664378,1664379,18/11/2015,"Discussione della proposta di legge: Sorial ed altri: Disposizioni in materia di acquisto e dismissione delle autovetture di servizio o di rappresentanza delle pubbliche amministrazioni (A.C. 3220-A) (ore 20,50) (Discussione sulle linee generali – A.C. 3220-A)",504,1,1,Ivan Catalano,CI-SC,"Presidente, onorevoli colleghi, la proposta di legge in discussione muove dal condivisibile obiettivo di contrastare l'abuso delle auto di servizio, oggi sempre meno giustificabile alla luce della pressione fiscale, dei vincoli di bilancio e dell'entità del nostro debito pubblico.",IT-Parlamento,ITA,0,20,32460.0,2281.0
690805,690806,02/08/2012,Si riprende la discussione. (Ripresa discussione sulle linee generali - A.C. 5389),59,3,1,Amedeo Ciccanti,UDC,"Attenzione, queste dinamiche di spesa incrementano il debito pubblico che, invece, deve ridursi.",IT-Parlamento,ITA,0,1,32610.0,201.0
1866226,1866227,02/08/2016,Si riprende la discussione. (Dichiarazioni di voto finale – A.C. 3976),77,1,2,Oreste Pastorelli,MISTO,Tale legge pone infatti una serie di regole volte a garantire l'equilibrio di bilancio di tutte le pubbliche amministrazioni nonché a realizzare la sostenibilità del debito pubblico.,IT-Parlamento,ITA,0,1,,
2327839,2327840,24/10/2019,"Seguito della discussione del disegno di legge: Conversione in legge del decreto-legge 21 settembre 2019, n. 105, recante disposizioni urgenti in materia di perimetro di sicurezza nazionale cibernetica (A.C. 2100-A) (ore 10,25). (ore 10,25) (Esame degli ordini del giorno - A.C. 2100-A)",129,3,2,Andrea Delmastro Delle Vedove,FDI,"Mi immaginavo che il Governo, che eredita la Via della seta e in cui siedono esponenti della maggioranza che voleva la Via della seta, persone che, ad agosto del 2018, addirittura volevano vendere il debito pubblico ai cinesi, evidentemente non avrebbe colto l'importanza di questo ordine del giorno.",IT-Parlamento,ITA,0,19,32630.0,2280.0
2114921,2114922,18/09/2018,Si riprende la discussione. (Dichiarazioni di voto finale - A.C. 851-A),125,4,1,Rebecca Frassini,LEGA-LN,"Questa è la dimostrazione che le politiche di bilancio fatte in questi anni non hanno assolutamente dato gli effetti sperati; anzi, sono state politiche di bilancio volte ad aumentare il debito pubblico senza portare, però, una reale diminuzione della pressione fiscale del nostro Paese, una tra le più alte d'Europa e che è divenuta, ormai, insostenibile.",IT-Parlamento,ITA,1,1,32720.0,1221.0
2201597,2201598,19/06/2018,"Si riprende la discussione. (Dichiarazioni di voto - Doc. LVII, n. 1)",102,1,2,Maurizio Lupi,MISTO,"Se si vuole abbattere (e concludo) il debito pubblico, bisogna avere il coraggio che lo Stato faccia lo Stato, e che lasci la possibilità a chi può fare meglio di fare meglio.",IT-Parlamento,ITA,0,1,,
631761,631762,07/09/2011,"Seguito della discussione delle mozioni Renato Farina ed altri n. 1-00702, Evangelisti ed altri n. 1-00705, Binetti ed altri n. 1-00706, Di Biagio e Della Vedova n. 1-00707, Mosella ed altri n. 1-00708 e Tempestini ed altri n. 1-00709 concernenti iniziative in relazione alla grave carestia che ha colpito il Corno d'Africa (ore 13,05) (Dichiarazioni di voto)",109,3,3,Donato Renato Mosella,MISTO,"L'Italia vive un momento grave e difficile ma non è ripiegandosi su se stessa che ne uscirà, non è certamente ignorando la tragedia dell'Africa che ripianeremo il debito pubblico.",IT-Parlamento,ITA,0,1,,
804953,804954,25/01/2012,"Discussione delle mozioni Franceschini ed altri n. 1-00800, Cicchitto ed altri n. 1-00802, Cambursano e Brugger n. 1-00818, Mecacci ed altri n. 1-00821, Donadi ed altri n. 1-00822 e Antonione ed altri n. 1-00823 sulla politica europea dell'Italia. (Dichiarazioni di voto)",143,7,8,Maurizio Fugatti,LEGA-LN,"Dobbiamo dire agli italiani che ogni anno paghiamo 70-80 miliardi di interessi sul debito pubblico e, se dovessimo pagare anche questi 40 miliardi, sarebbe veramente difficile.",IT-Parlamento,ITA,0,1,32720.0,1221.0
901727,901728,21/11/2013,"Seguito della discussione del disegno di legge: Conversione in legge del decreto-legge 15 ottobre 2013, n. 120, recante misure urgenti di riequilibrio della finanza pubblica nonché in materia di immigrazione (A.C. 1690-A). (Dichiarazioni di voto finale – A.C. 1690-A)",162,9,2,Andrea Romano,CI-SC,"Un conto è, come riteniamo che poi dovrà essere, se la Cassa depositi e prestiti funziona da veicolo, per l'appunto, da strumento temporaneo, da società che permette tecnicamente la messa sul mercato di beni pubblici inutilizzati o sottoutilizzati, che possono essere meglio gestiti e meglio utilizzati anche dalla collettività, oltre a ridurre il debito pubblico; un altro conto, invece, è se il passaggio alla Cassa depositi e prestiti è solo uno strumento per mantenere la proprietà dello Stato su quei beni e dunque – lo ricordiamo – una modalità attraverso cui una società priva di debiti, come è la Cassa depositi e prestiti, entra in possesso di beni che non dovrebbe avere alcun interesse a vendere, proprio perché è priva di debiti.",IT-Parlamento,ITA,0,1,32460.0,2281.0
330463,330464,26/07/2010,"Discussione del disegno di legge: S. 2228 - Conversione in legge, con modificazioni, del decreto-legge 31 maggio 2010, n. 78, recante misure urgenti in materia di stabilizzazione finanziaria e di competitività economica (Approvato dal Senato) (A.C. 3638). (Discussione sulle linee generali - A.C. 3638)",8,11,1,Antonio Borghesi,IDV,"I problemi relativi al debito pubblico si affrontano solamente in tre modi: attraverso il fallimento (mi sembra che non possiamo permettercelo), attraverso l'inflazione (ma non è più possibile ricorrere a questa soluzione, poiché siamo integrati in un'economia), oppure attraverso la crescita, che generi un avanzo primario, che permetta, poi, di pagare i debiti.",IT-Parlamento,ITA,0,1,32902.0,768.0
1181888,1181889,13/01/2014,"Discussione della mozione Ciprini ed altri n. 1-00292, concernente iniziative in ambito europeo e nazionale per la revisione dei vincoli derivanti dal Trattato noto come «fiscal compact» (ore 11,56) (Discussione sulle linee generali)",20,2,1,Giovanni Paglia,SEL-SI,"La mia tesi di laurea, che io scrissi molti anni fa, si proponeva allora di indagare la struttura del debito pubblico dei paesi del sud del mondo.",IT-Parlamento,ITA,0,19,32230.0,1212.0
459780,459781,28/04/2011,"Discussione del documento: Documento di economia e finanza 2011 (Doc. LVII n. 4) (ore 9,45). (Dichiarazioni di voto - Doc. LVII, n. 4)",104,5,2,Giorgio La Malfa,MISTO,"Egli ha insistito, dicendo che nel calcolo del debito bisogna considerare non solo il debito pubblico, ma anche il debito privato, che è una ragionevole considerazione, ne diamo atto al ministro Tremonti: la risposta dell'Europa è stata «no», l'unico parametro è il debito pubblico che deve essere ridotto di un ventesimo ogni anno.",IT-Parlamento,ITA,1,1,,
843060,843061,05/03/2012,"Discussione del progetto di legge costituzionale: Cambursano ed altri; Marinello ed altri; Beltrandi ed altri; Merloni ed altri; Lanzillotta ed altri; Antonio Martino ed altri; d'iniziativa del Governo; Bersani ed altri: Introduzione del principio del pareggio di bilancio nella Carta costituzionale (Approvato, in un testo unificato, in prima deliberazione, dalla Camera dei deputati e approvato, senza modificazioni, in prima deliberazione, dal Senato) (A.C. 4205-4525-4526-4594-4596-4607-4620-4646-B) (ore 15,08). (Discussione sulle linee generali - A.C. 4205-B ed abbinati)",15,8,6,Massimo Vannucci,PD,"Allora, dobbiamo farci carico delle migliori esperienze europee in questo senso, affinché vi sia questa commissione fiscale indipendente che riesca a valutare e rendere noti ai cittadini gli effetti sul debito pubblico dei programmi e dei progetti economici.",IT-Parlamento,ITA,1,1,32440.0,802.0
338173,338174,19/11/2010,Si riprende la discussione. (Dichiarazioni di voto finale - A.C. 3778-A),166,2,1,Massimo Bitonci,LEGA-LN,"Stabilità e rigore nei conti pubblici: per questo abbiamo lavorato, per mettere in sicurezza il sistema bancario e finanziario, senza aumentare la pressione fiscale, ma sostegno alle famiglie e aziende con la cassa integrazione e gli ammortizzatore sociali, non con la politica che vorrebbe la sinistra, politica economica con manovre in deficit, con aumento del debito pubblico, oppure finanziata con aumento della pressione fiscale e la tassazione dei BOT delle famiglie.",IT-Parlamento,ITA,0,1,32720.0,1221.0
735984,735985,11/12/2012,"Discussione della proposta di legge: Disposizioni per l'attuazione del principio del pareggio di bilancio ai sensi dell'articolo 81, sesto comma, della Costituzione (A.C. 5603-A) (ore 11,11). (Discussione sulle linee generali - A.C. 5603-A)",4,4,2,Lino Duilio,PD,"Tutto ciò è stato realizzato per tenere fede agli impegni assunti in ambito comunitario, in ambito europeo, per cui abbiamo costituzionalizzato queste regole di bilancio con l'intento di limitare il ricorso all'indebitamento e di garantire la sostenibilità del debito pubblico nel medio e nel lungo periodo, in coerenza con la recente revisione delle regole stabilite dal Patto di stabilità e crescita.",IT-Parlamento,ITA,1,1,32440.0,802.0
843254,843255,05/03/2012,"Discussione del progetto di legge costituzionale: Cambursano ed altri; Marinello ed altri; Beltrandi ed altri; Merloni ed altri; Lanzillotta ed altri; Antonio Martino ed altri; d'iniziativa del Governo; Bersani ed altri: Introduzione del principio del pareggio di bilancio nella Carta costituzionale (Approvato, in un testo unificato, in prima deliberazione, dalla Camera dei deputati e approvato, senza modificazioni, in prima deliberazione, dal Senato) (A.C. 4205-4525-4526-4594-4596-4607-4620-4646-B) (ore 15,08). (Discussione sulle linee generali - A.C. 4205-B ed abbinati)",23,14,1,Aurelio Salvatore Misiti,MISTO,"Ad una domanda - qui chiudo - fatta in televisione (in RAI) al Presidente Monti in occasione dell'intervista rilasciata a Fabio Fazio, che gli ha chiesto come si possa ridurre questo 120 per cento se il pareggio da solo non lo può fare, il Presidente Monti ha risposto: l'equilibrio del bilancio nel 2013 vuol dire che, al netto degli interessi pagati sul debito pubblico, l'Italia avrà un avanzo di bilancio pari al 5 per cento del PIL, e così si abbassa il rapporto debito-PIL.",IT-Parlamento,ITA,0,1,,
821555,821556,18/07/2012,"Discussione congiunta dei disegni di legge: S. 2914 - Ratifica ed esecuzione della Decisione del Consiglio europeo 2011/199/UE che modifica l'articolo 136 del Trattato sul funzionamento dell'Unione europea relativamente a un meccanismo di stabilità per gli Stati membri la cui moneta è l'euro, fatta a Bruxelles il 25 marzo 2011 (Approvato dal Senato) (A.C. 5357); S. 3239 - Ratifica ed esecuzione del Trattato sulla stabilità, sul coordinamento e sulla governance nell'Unione economica e monetaria tra il Regno del Belgio, la Repubblica di Bulgaria, il Regno di Danimarca, la Repubblica federale di Germania, la Repubblica di Estonia, l'Irlanda, la Repubblica ellenica, il Regno di Spagna, la Repubblica francese, la Repubblica italiana, la Repubblica di Cipro, la Repubblica di Lettonia, la Repubblica di Lituania, il Granducato di Lussemburgo, l'Ungheria, Malta, il Regno dei Paesi Bassi, la Repubblica d'Austria, la Repubblica di Polonia, la Repubblica portoghese, la Romania, la Repubblica di Slovenia, la Repubblica slovacca, la Repubblica di Finlandia e il Regno di Svezia, con Allegati, fatto a Bruxelles il 2 marzo 2012 (Approvato dal Senato) (A.C. 5358); S. 3240 - Ratifica ed esecuzione del Trattato che istituisce il Meccanismo europeo di stabilità (MES), con Allegati, fatto a Bruxelles il 2 febbraio 2012 (Approvato dal Senato) (A.C. 5359) (ore 19,15) (Discussione congiunta sulle linee generali - A.C. 5357 - A.C. 5358 - A.C. 5359)",225,9,1,Marco Maggioni,LEGA-LN,"Mi chiedo se 700 miliardi possono essere sufficienti in un contesto europeo, dove solo il debito pubblico italiano è quasi tre volte l'ammontare di questo Fondo?",IT-Parlamento,ITA,1,1,32720.0,1221.0
364750,364751,18/10/2010,"Discussione delle mozioni Esposito ed altri n. 1-00437, Delfino ed altri n. 1-00439 e Ghiglia ed altri n. 1-00442, concernenti iniziative volte alla realizzazione della linea ferroviaria alta velocità/alta capacità Torino-Lione (ore 18,05) (Discussione sulle linee generali)",43,2,1,Roberto Tortoli,PDL,Quello delle infrastrutture è il vero tallone d'Achille del nostro Paese che soffre per un alto debito pubblico aggravato proprio dal fatto che i soldi dell'indebitamento non sono stati a suo tempo usati negli anni delle vacche grasse per investimenti infrastrutturali.,IT-Parlamento,ITA,0,10,32061.0,365.0
667272,667273,12/03/2012,"Discussione delle mozioni Montagnoli ed altri n. 1-00896, Lombardo ed altri n. 1-00901, Fluvi ed altri n. 1-00910 e Misiti ed altri n. 1-00911 concernenti misure a favore delle piccole e medie imprese in materia di accesso al credito e per la tempestività dei pagamenti delle pubbliche amministrazioni (ore 15,36) (Discussione sulle linee generali)",57,12,2,Sergio Michele Piffari,IDV,"Questo è intanto imbrogliare, lo ripeto, partner come l'Europa, con i quali ci stiamo prendendo impegni per il rientro del debito pubblico.",IT-Parlamento,ITA,1,1,32902.0,768.0
1002744,1002745,01/10/2013,Seguito della discussione dei disegni di legge: S. 888 – Rendiconto generale dell'Amministrazione dello Stato per l'esercizio finanziario 2012 (Approvato dal Senato) (A.C. 1572) e S. 889 – Disposizioni per l'assestamento del bilancio dello Stato e dei bilanci delle Amministrazioni autonome per l'anno finanziario 2013 (Approvato dal Senato) (A.C. 1573). (Dichiarazioni di voto finale – A.C. 1572),74,1,4,Maino Marchi,PD,"Ma contestualmente il debito pubblico aumenta al 127 per cento, gli interessi sul debito pubblico del 10,7 per cento, da 78 miliardi a quasi 87, e questo dimostra che lo spread non è un'invenzione, non è un falso problema, ma ha degli effetti concreti.",IT-Parlamento,ITA,0,1,32440.0,802.0
790971,790972,26/04/2012,"Si riprende la discussione. (Dichiarazioni di voto - Doc. LVII, n. 5)",165,3,5,Antonio Borghesi,IDV,Ma il debito pubblico come lo tagliamo?,IT-Parlamento,ITA,0,1,32902.0,768.0
1163605,1163606,25/02/2014,Si riprende la discussione sulle comunicazioni del Governo. (Ripresa discussione),144,3,7,Alessio Mattia Villarosa,M5S,"Quindi, la sua soluzione è quella di ridurre un debito pubblico pari a 2.100 miliardi con 4 miliardi di euro ?",IT-Parlamento,ITA,1,1,32956.0,2046.0
2028589,2028590,04/10/2017,"Esame della Nota di aggiornamento del Documento di economia e finanza 2017 (Doc. LVII, n. 5-bis) (ore 16,33). (ore 16,33) (Discussione – Doc. LVII, n. 5-bis)",161,1,8,Laura Castelli,M5S,"Paese funzionano, che sono il modo per abbattere il debito pubblico, quando sappiamo totalmente, fortemente - lo sanno soprattutto i membri della Commissione bilancio - che la correlazione tra l'abbattimento del debito pubblico e le privatizzazioni è inesistente.",IT-Parlamento,ITA,1,1,32956.0,2046.0
1261901,1261902,27/01/2014,"Si riprende la discussione (ore 16,15) (Ripresa esame degli ordini del giorno – A.C. 1941)",475,1,2,Vittorio Ferraresi,M5S,"Noi chiediamo l'impegno del Governo per adottare, per quanto di competenza, le iniziative affinché ai partecipanti il capitale sociale della Banca d'Italia possano essere distribuiti esclusivamente dividendi annuali a valere sugli utili netti, per un importo non superiore a una percentuale del capitale sociale pari al tasso medio ponderato riconosciuto sui titoli del debito pubblico con durata non superiore all'anno, emessi nell'anno solare precedente dallo Stato italiano.",IT-Parlamento,ITA,0,1,32956.0,2046.0
1746034,1746035,25/05/2016,"In ricordo dell'onorevole Marco Pannella (ore 16,17)",367,1,14,Benedetto Della Vedova,,"Le sue battaglie: divorzio, aborto, nuovo diritto di famiglia, fame nel mondo, giustizia giusta e responsabilità civile dei giudici, finanziamento pubblico, legalizzazione della cannabis quarant'anni prima che diventasse misura di Governo nel Nord America e non solo; ma anche in quest'Aula e già in tutta Italia, grazie alla straordinaria Radio Radicale, moniti inascoltati negli anni Ottanta sulla follia del debito pubblico dilagante, sulle baby pensioni e, poi, sulle liberalizzazioni del mercato del lavoro e dei mercati protetti, sulle privatizzazioni come strumento di efficienza economica e di moralizzazione civile dell'Italia partitocratica e, ancora, la moratoria sulla pena di morte, il tribunale penale internazionale contro i crimini di guerra e genocidio, il diritto di conoscenza come diritto politico per eccellenza, il fine vita, le condizioni delle carceri come misura di civiltà e di legalità di un Paese, e potrei continuare.",IT-Parlamento,ITA,0,20,,
556481,556482,04/04/2011,"Discussione della proposta di legge: Giancarlo Giorgetti ed altri: Modifiche alla legge 31 dicembre 2009, n. 196, conseguenti alle nuove regole adottate dall'Unione europea in materia di coordinamento delle politiche economiche degli Stati membri (Approvata dalla Camera e modificata dal Senato) (A.C. 3921-B) (Approvata dalla Camera e modificata dal Senato) (ore 15,39). (Discussione sulle linee generali - A.C. 3921-B)",12,16,2,Renato Cambursano,IDV,"Vorrei richiamare soltanto un obiettivo che ho visto essere condiviso, per il momento ancora in fase interrogativa, da parte del Ministro dell'economia e delle finanze: mi riferisco cioè al fatto di mettere sullo stesso piano anche l'Italia, attrezzandola con gli stessi strumenti con cui si sono attrezzate intanto già la Germania nel 2009, mentre la Francia lo sta facendo proprio in questi giorni, cioè costituzionalizzare l'impegno sul debito pubblico.",IT-Parlamento,ITA,1,1,32902.0,768.0
429748,429749,29/09/2010,"Comunicazioni del Governo sulla situazione politica generale (ore 11,03) (Discussione)",42,5,1,Davide Caparini,LEGA-LN,"La Costituzione negata ha generato il terzo debito pubblico al mondo, uno Stato centrale mastodontico, elefantiaco, impacciato, lento, incapace di dare le risposte alle molteplici ed eterogenee istanze delle comunità locali.",IT-Parlamento,ITA,0,20,32720.0,1221.0
1002672,1002673,01/10/2013,Seguito della discussione dei disegni di legge: S. 888 – Rendiconto generale dell'Amministrazione dello Stato per l'esercizio finanziario 2012 (Approvato dal Senato) (A.C. 1572) e S. 889 – Disposizioni per l'assestamento del bilancio dello Stato e dei bilanci delle Amministrazioni autonome per l'anno finanziario 2013 (Approvato dal Senato) (A.C. 1573). (Dichiarazioni di voto finale – A.C. 1572),68,1,2,Rocco Palese,PDL,"Preoccupanti i dati relativi alla spesa per interessi del debito pubblico, in particolare se si considera che nel bilancio programmatico, presentato con la Nota di aggiornamento, la previsione al 2016 supera i 100 miliardi di euro, in confronto agli 81,3 miliardi di euro riferiti al 2012 e agli oltre 89 miliardi di euro risultanti nelle previsioni assestate.",IT-Parlamento,ITA,0,1,32061.0,365.0
1181413,1181414,02/07/2014,"Discussione del testo unificato delle proposte di legge: Fedriga e Caparini; Murer ed altri; Damiano ed altri; Polverini; Fedriga ed altri; Di Salvo ed altri; Airaudo ed altri: Modifiche alla disciplina dei requisiti per la fruizione delle deroghe riguardanti l'accesso al trattamento pensionistico. (A.C. 224-387-727-946-1014-1045-1336-A) (ore 16,20). (Esame dell'articolo 1 – A.C. 224-A ed abbinate)",295,1,4,Irene Tinagli,CI-SC,"Ma, come ha ricordato l'onorevole Buttiglione, anche per senso di serietà e di onestà intellettuale nei confronti dei cittadini, dovremmo riconoscere la situazione in cui l'Italia era a fine del 2011: centinaia di miliardi di capitali in fuga dal nostro Paese, perché nessuno più credeva nella sostenibilità del nostro debito pubblico e della nostra intenzione di riformare alcune questioni fondamentali e non più rimandabili nel nostro sistema.",IT-Parlamento,ITA,0,1,32460.0,2281.0
279173,279174,19/07/2010,"Discussione congiunta dei disegni di legge: Rendiconto generale dell'amministrazione dello Stato per l'esercizio finanziario 2009 (A.C. 3593) e Disposizioni per l'assestamento del bilancio dello Stato e dei bilanci delle Amministrazioni autonome per l'anno finanziario 2010 (A.C. 3594) (ore 17,10). (Discussione congiunta sulle linee generali - A.C. 3593 e A.C. 3594)",6,36,1,Rocco Girlanda,PDL,"La riduzione della dotazione di cassa della spesa corrente dipende per la gran parte dal forte decremento della spesa per interessi, per un totale di 5.364 milioni, determinata per lo più dall'adeguamento all'effettivo fabbisogno per gli interessi sui titoli del debito pubblico.",IT-Parlamento,ITA,0,1,32061.0,365.0
1506116,1506117,17/07/2015,Svolgimento di interpellanze urgenti (Elementi e iniziative in merito a un rilevante fenomeno di evasione fiscale da parte di imprenditori cinesi emerso a seguito di una recente operazione condotta dalla Guardia di finanza – n. 2-01010),111,7,1,Girgis Giorgio Sorial,,"L'avete permesso svendendo quote di tutti questi settori strategici, di un settore strategico come quello dell'energia, semplicemente per incassare qualche soldo da stanziare poi non a favore dei cittadini ma nel Fondo per l'ammortamento del debito pubblico, un buco nero dove sono stati messi quattrini svendendo parte degli asset italiani: anche questo è stato permesso al sistema finanziario cinese.",IT-Parlamento,ITA,0,1,,
1097891,1097892,18/12/2013,"Discussione congiunta dei disegni di legge: Disposizioni per la formazione del bilancio annuale e pluriennale dello Stato (legge di stabilità 2014) (A.C. 1865-A); Bilancio di previsione dello Stato per l'anno finanziario 2014 e bilancio pluriennale per il triennio 2014-2016 (e relativa nota di variazioni) (Approvati dal Senato) (A.C. 1866-A) (ore 16,15) (Discussione congiunta sulle linee generali – A.C. 1865-A-1866-A)",112,24,2,Vincenzo Garofalo,NCD,"Solo così, infatti, possiamo ridurre il nostro enorme debito pubblico e creare le condizioni per un miglioramento delle condizioni di vita dei nostri cittadini, frenando la dilagante fuga delle nostre risorse, intellettuali e creative, perdendo capitale che è prima di tutto umano ma che è anche fatto di competenza e professionalità, quello che i nostri giovani acquisiscono nel nostro Paese e che, via via, esportano altrove per mancanza di prospettive stabili in casa propria.",IT-Parlamento,ITA,0,1,,2052.0
