,instance_id,date,agenda,speechnumber,paragraphnumber,sentencenumber,speaker,party,text,parliament,iso3country,eu,policyarea,cmp_party,partyfacts
2043140,2043141,23/02/2017,"Discussione delle mozioni Bergamini ed altri n. 1-01249, Colletti ed altri n. 1-00239, Palese ed altri n. 1-01513, Marotta e Bosco n. 1-01515, Mattiello, Dambruoso ed altri n. 1-01516, Andrea Maestri ed altri n. 1-01517, Vezzali ed altri n. 1-01518, Molteni ed altri n. 1-01519 e Rampelli ed altri n. 1-01520 concernenti iniziative volte ad agevolare il trasferimento di detenuti stranieri nei Paesi d'origine (ore 13,48) (Dichiarazioni di voto)",296,4,3,Stefano Dambruoso,CI-SC,"Non andò a buon fine e oggi ci ritroviamo ad avere la necessità di stimolare e di sollecitare al massimo queste procedure, proprio perché si sta cercando di gestire quel fenomeno epocale che avviene con questa immigrazione, prevalentemente di origine africana, e con diversi Paesi dell'Africa centrale e del Nordafrica siamo già riusciti, in via bilaterale, ad attuare quello che è un obiettivo del Consiglio d'Europa, che con questa mozione si intende sollecitare.",IT-Parlamento,ITA,1,9,32460.0,2281.0
2285539,2285540,22/07/2019,Si riprende la discussione.,124,2,10,Stefano Lepri,PD,"Non c'è un disegno e non l'avete rappresentato in questa sede per favorire il rimpatrio ai siti volontari che sono, come sapete, un modo attraverso cui si può controllare e in qualche modo gestire i flussi di immigrazione irregolare, o anche regolare, di persone che hanno terminato una presenza nel nostro Paese, che magari prendono atto del loro fallimento e che magari, se opportunamente incentivati, potrebbero tornare.",IT-Parlamento,ITA,0,9,32440.0,802.0
167272,167273,23/06/2009,"Discussione del disegno di legge: S. 1078-B - Disposizioni per l'adempimento di obblighi derivanti dall'appartenenza dell'Italia alle Comunità europee - Legge comunitaria 2008 (Approvato dal Senato, modificato dalla Camera e nuovamente modificato dal Senato) (A.C. 2320-bis-B) bis (ore 10,08) (Discussione sulle linee generali - A.C. 2320-bis-B)",7,7,5,Sandro Gozi,PD,"Ricordo che con il Trattato di Lisbona i Parlamenti nazionali avranno un ruolo centrale in materia di diritti fondamentali, di immigrazione, di sicurezza e di giustizia.",IT-Parlamento,ITA,1,19,32440.0,802.0
1131345,1131346,13/02/2014,"Svolgimento di interpellanze urgenti (ore 9,35) (Chiarimenti in merito alla mancata partecipazione del Ministro per l'integrazione ad una manifestazione prevista a Brescia il 28 settembre 2013 – n. 2-00405)",4,4,1,Marco Rondini,LEGA-LN,"Il 4 febbraio 2014, il medesimo Carletti ha ribadito però la sua versione dei fatti, aggiungendo che la Kyenge avrebbe rinunciato alla propria presenza in seguito a pressioni esercitate dal sindaco di Brescia, Emilio Del Bono, di cui sussisterebbe traccia indiretta in una mail inviata da Giovanna Benini, responsabile del Forum immigrazione del Partito Democratico, alla segreteria del Ministro per l'integrazione.",IT-Parlamento,ITA,0,9,32720.0,1221.0
1481968,1481969,10/09/2015,"Discussione della Relazione della XIV Commissione sulla Relazione programmatica sulla partecipazione dell'Italia all'Unione europea per l'anno 2015 e sul Programma di lavoro della Commissione per il 2015 e sul Programma di diciotto mesi del Consiglio dell'Unione europea (Doc. LXXXVII-bis, n. 3-A) bis (ore 10,10). (Discussione – Doc. LXXXVII-bis, n. 3-A)",36,4,1,Paolo Alli,NCD,"Veniamo al tema dei temi che è quello dell'immigrazione, un tema di fronte al quale il cambiamento drastico di atteggiamento che si è verificato in Europa nel giro di poche settimane è un fatto mai visto prima nella storia, non solo della politica europea, ma in generale a livello mondiale.",IT-Parlamento,ITA,1,9,,2052.0
923797,923798,22/10/2013,Comunicazioni del Presidente del Consiglio dei ministri in vista del Consiglio europeo di Bruxelles del 24 e 25 ottobre 2013. (Discussione),21,1,2,Lara Ricciatti,SEL-SI,"Si parlerà di economia digitale, come ha già ricordato lei, signor Presidente, di innovazione, di servizi, di politica economica e sociale, con particolare riferimento alle misure per combattere la disoccupazione giovanile e sostenere le piccole e medie imprese, di futura architettura dell'unione economica e monetaria e delle politiche di immigrazione.",IT-Parlamento,ITA,0,1,32230.0,1212.0
681326,681327,13/03/2012,Si riprende la discussione del disegno di legge n. 4940-A. (Dichiarazioni di voto finale - A.C. 4940-A),389,9,1,Alberto Torazzi,LEGA-LN,"Per cui, non vi importa se la maggioranza comprende chi, fino a tre mesi fa, contestava questa politica di tasse e siede in Parlamento - lo voglio ricordare - perché ha promesso ai cittadini regole ferree sull'immigrazione e la sicurezza, e ora vota tutt'altro, colleghi del Popolo della Libertà (Applausi dei deputati del gruppo Lega Nord Padania), sorpresi, anche a mezzo stampa, della posizione della Lega.",IT-Parlamento,ITA,0,20,32720.0,1221.0
2169766,2169767,26/11/2018,"Discussione del disegno di legge: S. 840 - Conversione in legge, con modificazioni, del decreto-legge 4 ottobre 2018, n. 113, recante disposizioni urgenti in materia di protezione internazionale e immigrazione, sicurezza pubblica, nonché misure per la funzionalità del Ministero dell'interno e l'organizzazione e il funzionamento dell'Agenzia nazionale per l'amministrazione e la destinazione dei beni sequestrati e confiscati alla criminalità organizzata. Delega al Governo in materia di riordino dei ruoli e delle carriere del personale delle Forze di polizia e delle Forze armate (Approvato dal Senato) (A.C. 1346) (ore 10,10). (ore 10,10) (Discussione sulle linee generali – A.C. 1346)",4,31,1,Giuseppe Brescia,M5S,"In conclusione, mi sento di dire che, rispetto a tutta la parte riguardante il tema immigrazione, questo nuovo impianto reggerà se almeno tre componenti importanti funzioneranno, ossia la gestione degli arrivi, se si attesterà intorno alle cifre di quest'anno, dell'anno corrente, i tempi di attesa delle commissioni territoriali che dovranno necessariamente essere molto più brevi e quanto previsto dal decreto lascia ben sperare in tal senso, perché appunto viene potenziato il sistema delle commissioni territoriali, e se migliora di gran lunga tutta la parte relativa ai rimpatri, che devono essere molto superiori a quelli attuali.",IT-Parlamento,ITA,0,9,32956.0,2046.0
1782733,1782734,21/03/2016,"Discussione della Relazione della XIV Commissione sulla Relazione programmatica sulla partecipazione dell'Italia all'Unione europea riferita all'anno 2016, sul Programma di lavoro della Commissione per il 2016 e sul Programma di diciotto mesi del Consiglio dell'Unione europea (Doc. LXXXVII-bis, n. 4-A) bis (ore 18,35) (Discussione – Doc. LXXXVII-bis, n. 4-A)",81,6,9,Elvira Savino,FI,In poco meno di un anno l'azione della UE in materia di immigrazione ha visto ben 42 incontri e riunioni ai massimi livelli in Europa e ben 16 provvedimenti differenti adottati.,IT-Parlamento,ITA,1,9,32610.0,1626.0
2404635,2404636,09/09/2019,Si riprende la discussione. (Dichiarazioni di voto),403,1,6,Graziano Delrio,PD,"E la grande immigrazione, le grandi crisi economiche dipendono da questo.",IT-Parlamento,ITA,0,9,32440.0,802.0
1514859,1514860,27/11/2015,"Svolgimento di interpellanze urgenti (ore 9,35) (Elementi e iniziative di competenza in merito al rispetto del Testo unico delle disposizioni concernenti la disciplina dell'immigrazione e norme sulla condizione dello straniero, in particolare in relazione al fenomeno del «caporalato» – n. 2-01161)",41,1,3,Adriano Zaccagnini,SEL-SI,"Ci chiediamo per quale motivo non venga rilasciato il rinnovo del permesso di soggiorno se dalle modifiche del Testo unico sull'immigrazione, all'articolo 7, commi 7 e 8, nel momento in cui non c’è più bisogno di una residenza basta l'autocertificazione.",IT-Parlamento,ITA,0,9,32230.0,1212.0
909526,909527,19/06/2013,Informativa urgente del Governo sui recenti sbarchi di migranti a Lampedusa e in altre aree costiere. (Interventi),288,6,3,Gianluca Pini,LEGA-LN,"Quindi, quando si sente parlare di rivedere la legge sull'immigrazione (la legge voluta dal qui presente Umberto Bossi...",IT-Parlamento,ITA,0,9,32720.0,1221.0
2317220,2317221,16/07/2019,"Svolgimento di interrogazioni (ore 11,02). (ore 11,02) (Elementi e iniziative in merito all'organizzazione degli Uffici immigrazione e alla gestione del relativo personale – n. 3-00750)",30,1,4,Luigi Gaetti,,"Al riguardo, rammento che le divisioni Polizia amministrativa e sociale e dell'immigrazione (l'acronimo è PASI) sono state istituite nelle questure italiane sin dal 2001.",IT-Parlamento,ITA,0,12,,
927054,927055,21/05/2013,"Sull'ordine dei lavori (ore 18,20).",102,1,1,Khalid Chaouki,PD,"Signor Presidente, vorrei intervenire in merito ad una segnalazione che ci è stata fatta dall'Associazione per gli studi giuridici sull'immigrazione (Asgi) che si occupa di immigrazione e di minori in particolare, rispetto anche alla manifestazione che tuttora è qui fuori dalla Camera, con oltre 300 minori di origine del Bangladesh.",IT-Parlamento,ITA,0,9,32440.0,802.0
921931,921932,15/05/2013,Svolgimento di interrogazioni a risposta immediata. (Intendimenti del Ministro per l'integrazione con riguardo all'introduzione dello ius soli nell'ordinamento italiano e all'abrogazione del reato di immigrazione clandestina – n. 3-00053),63,1,2,Cécile Kyenge,PD,"Signor Presidente, onorevoli colleghi, il deputato Molteni chiede di conoscere molteplici intendimenti del Ministro per l'integrazione in merito ad eventuali modifiche della legge sulla cittadinanza, all'abrogazione del reato di immigrazione clandestina, alla chiusura dei CIE, dove – faccio notare – si può restare privati della libertà personale fino a diciotto mesi, nonché chiede di conoscere se si tratta di priorità del mio Ministero.",IT-Parlamento,ITA,0,9,32440.0,802.0
553450,553451,24/01/2011,"Discussione del disegno di legge: Conversione in legge del decreto-legge 29 dicembre 2010, n. 228, recante proroga degli interventi di cooperazione allo sviluppo e a sostegno dei processi di pace e di stabilizzazione, nonché delle missioni internazionali delle forze armate e di polizia (A.C. 3996-A) (ore 12,15). (Discussione sulle linee generali - A.C. 3996-A)",13,2,9,Mario Barbi,PD,"Si quadruplica la spesa della missione italo-libica per contrastare l'immigrazione clandestina da due a otto milioni; resta assai importante l'azione di contrasto alla pirateria dinanzi alle coste somale in ambito sia NATO Ocean Shield che Unione europea, Atalanta, così come permane di una certa importanza l'impegno in ambito NATO per l'addestramento delle forze di sicurezza irachene.",IT-Parlamento,ITA,0,9,32440.0,802.0
277491,277492,29/07/2010,Si riprende la discussione. (Ripresa esame degli ordini del giorno - A.C. 3638),174,1,4,Angelo Compagnon,UDC,"Qui si tratta di un ordine del giorno che individua la posizione di 650 unità che hanno vinto un concorso per il quale la legge prevedeva la stabilizzazione definitiva di precari già dipendenti del Ministero dell'interno che in questo momento, dopo aver vinto il concorso, sono impiegati negli uffici immigrazione di prefetture e di questure in tutta Italia.",IT-Parlamento,ITA,0,20,32610.0,201.0
104717,104718,30/04/2009,Si riprende la discussione. (Ripresa della discussione sulle linee generali - A.C. 2180-A),32,8,2,Giorgio Clelio Stracquadanio,PDL,"Perché solo chi non può acquistare sicurezza supplementare con il danaro ed è costretto ad accontentarsi della sicurezza che noi gli diamo - ed è una sicurezza che non esiste perché consentiamo al clandestino, cioè a chi sta delinquendo, di prosperare nel delinquere - si ribellerà, tanto è vero che i dati elettorali testimoniano come nei quartieri popolari questi argomenti (e a volte argomenti anche più forti) contro la clandestinità e contro l'immigrazione si fanno strada.",IT-Parlamento,ITA,0,12,32061.0,365.0
564451,564452,11/07/2011,"Discussione del disegno di legge: Conversione in legge del decreto-legge 23 giugno 2011, n. 89, recante disposizioni urgenti per il completamento dell'attuazione della direttiva 2004/38/CE sulla libera circolazione dei cittadini comunitari e per il recepimento della direttiva 2008/115/CE sul rimpatrio dei cittadini di Paesi terzi irregolari (A.C. 4449-A) (ore 16,08). (Discussione sulle linee generali - A.C. 4449-A)",10,2,1,Isabella Bertolini,PDL,"Vi è un'altra innovazione che abbiamo apportato in Commissione e ci tengo a sottolinearla: abbiamo introdotto un emendamento che comporta una modifica importante al Testo unico sull'immigrazione, in particolare all'articolo 32.",IT-Parlamento,ITA,1,9,32061.0,365.0
1929204,1929205,13/07/2016,"Svolgimento di interrogazioni a risposta immediata. (Iniziative volte a proseguire l'azione di contrasto all'estremismo islamico, con particolare riferimento alla cooperazione con l'Egitto – n. 3-02386)",219,2,3,Ignazio La Russa,FDI,"Ben venga un'azione di dignità, ma si può scegliere non un'azione che metta a repentaglio la lotta al terrorismo e il contrasto all'immigrazione clandestina.",IT-Parlamento,ITA,0,9,32630.0,2280.0
154116,154117,24/11/2009,Si riprende la discussione. (Ripresa dichiarazioni di voto),89,1,2,Margherita Boniver,PDL,"Questa è la parola chiave che dobbiamo tenere in mente quando si parla di immigrazione, di integrazione, di contrasto all'immigrazione clandestina, degli obblighi internazionali in materia umanitaria.",IT-Parlamento,ITA,0,9,32061.0,365.0
1008297,1008298,20/11/2013,"Seguito della discussione del disegno di legge: Conversione in legge del decreto-legge 15 ottobre 2013, n. 120, recante misure urgenti di riequilibrio della finanza pubblica nonché in materia di immigrazione (A.C. 1690-A) (ore 16,06) (Esame dell'articolo unico – A.C. 1690-A)",228,2,2,Massimo Enrico Corsaro,FDI,"Si cancellano 90 dei 100 milioni di euro di cui è costituito questo fondo e si utilizzano 50 milioni di euro, peraltro inesistenti, in un fondo che al momento non è capiente e, quindi, non c’è misura di copertura, prelevandoli dalla destinazione che dovrebbe essere prevista per il supporto alle vittime della mafia e dell'estorsione, per fare la costituzione di una dotazione per l'accoglienza straordinaria a fronte dei nuovi flussi di immigrazione nel nostro Paese.",IT-Parlamento,ITA,0,9,32630.0,2280.0
2294631,2294632,25/06/2019,"Discussione della relazione delle Commissioni III (Affari esteri e comunitari) e IV (Difesa) sulla deliberazione del Consiglio dei Ministri in merito alla partecipazione dell'Italia a ulteriori missioni internazionali per l'anno 2019, adottata il 23 aprile 2019 (Doc. XXV, n. 2) e sulla relazione analitica sulle missioni internazionali in corso e sullo stato degli interventi di cooperazione allo sviluppo a sostegno dei processi di pace e di stabilizzazione, riferita al periodo 1° ottobre-31 dicembre 2018, anche al fine della relativa proroga per il periodo 1° gennaio-31 dicembre 2019, deliberata il 23 aprile 2019 (Doc. XXVI, n. 2). (Doc. XVI, n. 2) (ore 9,34). (ore 9,34) (Discussione - Doc. XVI, n. 2)",11,16,3,Riccardo Olgiati,M5S,"La proposta di relazione all'Assemblea approvata è stata quella dei relatori ma è stato approvato anche un emendamento riformulato, a prima firma dell'onorevole Quartapelle Procopio, che prevede, con riferimento alla missione bilaterale di assistenza alla Guardia costiera libica, di cui alla scheda n. 23/2019, di autorizzarla impegnando il Governo a una verifica stringente e costante che le imbarcazioni fornite dall'Italia alla Libia, con particolare riguardo ai modelli dei guardacoste Corrubia, montino solo la strumentazione utile al controllo e alla sicurezza nel contrasto all'immigrazione illegale e al traffico di esseri umani, nonché alle attività di soccorso in mare in rispetto delle vigenti disposizioni internazionali ed europee in materia di embargo.",IT-Parlamento,ITA,0,16,32956.0,2046.0
230245,230246,13/07/2010,"Discussione della relazione della XIV Commissione sul Programma di lavoro della Commissione europea per il 2010 e sul programma di 18 mesi del Consiglio dell'Unione europea presentato dalle Presidenze spagnola, belga e ungherese (Doc. XVIII, n. 24) (ore 9,06). (Discussione - Doc. XVIII, n. 24)",8,4,2,Pier Paolo Baretta,PD,"La vicenda stessa della direttiva Bolkestein ci dà la misura del problema e i fattori demografici, nell'evidente positività dell'allungamento della vita media, pongono, anche a causa della caduta del tasso di fertilità, il tema dell'invecchiamento delle aree più storiche mentre l'immigrazione diventa, anche per queste ragioni, un fenomeno forse regolabile, ma inarrestabile.",IT-Parlamento,ITA,0,9,32440.0,802.0
1634256,1634257,25/03/2015,Si riprende la discussione del disegno di legge di conversione n. 2893-A. (Ripresa discussione sulle linee generali – A.C. 2893-A),139,18,1,Tatiana Basilio,M5S,"È palese che questa missione che non ha fermato l'immigrazione e, ahimè, nemmeno è servita a pacificare due Governi e un buon numero di tribù, che si sono trovate a briglia sciolta dopo che la Francia e gli Stati facenti parte della NATO, con un'operazione militare, hanno deciso di rovesciare quella parvenza di stabilità che aveva una nazione, purtroppo governata – è vero – all'epoca da un dittatore.",IT-Parlamento,ITA,0,19,32956.0,2046.0
1479813,1479814,10/06/2015,Seguito della discussione del disegno di legge: Disposizioni per l'adempimento degli obblighi derivanti dall'appartenenza dell'Italia all'Unione europea – Legge europea 2014 (A.C. 2977-A) (Dichiarazioni di voto finale – A.C. 2977-A),71,8,1,Elvira Savino,FI,"Vorrei ricordare che la Camera, alla vigilia del Consiglio europeo straordinario dello scorso aprile, sul problema dell'immigrazione, approvando il dispositivo della nostra risoluzione, impegnava il Governo ad una serie di iniziative, come, per esempio: istituire un tavolo di coesione nazionale per l'emergenza immigrazione e per le crisi internazionali in atto; adottare ogni iniziativa per promuovere un'azione incisiva a livello europeo; trovare la strada giuridicamente e politicamente congrua per intervenire, con un ruolo di leadership, sulla costa libica, nell'ambito di una forza multinazionale sotto l'egida delle organizzazioni internazionali; valutare l'opportunità di ricorrere anche ad altri strumenti di intervento, quali la sottrazione del costo che l'Italia sostiene per far fronte ad un'emergenza che è di tutta l'Europa, e di cui, invece, ci facciamo carico solo noi, dal contributo che ogni anno il nostro Paese versa all'Unione europea.",IT-Parlamento,ITA,1,19,32610.0,1626.0
2457014,2457015,20/02/2019,Ordine del giorno della prossima seduta.,402,18,2,Presidente,,"Seguito della discussione delle mozioni Lollobrigida ed altri n. 1-00113 e Magi e Schullian n. 1-00121 concernenti iniziative per il contrasto all'immigrazione clandestina e alle organizzazioni criminali straniere, con particolare riferimento alla cosiddetta mafia nigeriana .",IT-Parlamento,ITA,0,9,,
1549607,1549608,28/10/2015,"Seguito della discussione delle mozioni Ravetto, Totaro ed altri n. 1-00989, Brescia ed altri n. 1-01033, Fiano ed altri n. 1-01035 e Marotta ed altri n. 1-01039 concernenti iniziative volte all'istituzione presso i tribunali ordinari di sezioni specializzate per i procedimenti giurisdizionali in materia di immigrazione. (Dichiarazioni di voto)",372,1,4,Nicola Molteni,LEGA-LN,"Avremmo voluto e ci saremmo aspettati che per affrontare questo tema, che tra l'altro è all'ordine del giorno della politica nazionale ed europea ormai da anni, fosse presente in questa aula il Ministro dell'immigrazione clandestina di questo Paese, il Ministro Alfano.",IT-Parlamento,ITA,1,9,32720.0,1221.0
2073520,2073521,06/08/2018,Si riprende la discussione. (Dichiarazioni di voto finale - A.C. 1004),396,1,5,Gian Mario Fragomeli,PD,"Si sente di dire queste cose e giustamente tutto perché va giustificata una politica di contrasto ai trafficanti, perché appunto bisogna contrastare quello che in questo modo oggi è una politica dell'immigrazione.",IT-Parlamento,ITA,0,9,32440.0,802.0
65077,65078,05/05/2009,Si riprende la discussione. (Ripresa esame di questioni pregiudiziali - A.C. 2180-A),38,1,1,Rocco Buttiglione,UDC,"Il cammino da percorrere è un altro ed è quello - da me più volte indicato - di una conferenza dei Paesi rivieraschi del Mediterraneo per combattere l'immigrazione clandestina, ma anche per aprire i canali dell'immigrazione legale.",IT-Parlamento,ITA,0,9,32610.0,201.0
760537,760538,16/01/2012,"Discussione della mozione Reguzzoni n. 1-00803 sulla cooperazione con il Governo libico per la gestione dei flussi migratori originati dalla Libia durante il recente conflitto (ore 18,50) (Discussione sulle linee generali)",62,3,2,Fabio Porta,PD,"È in questo quadro che si inserisce il memorandum di intesa, firmato il 17 giugno del 2011, sulla collaborazione in materia di contrasto all'immigrazione clandestina, con cui il Consiglio nazionale di transizione si è impegnato a rispettare i precedenti accordi italo-libici e a rafforzare la collaborazione bilaterale in materia di sicurezza sulla base dell'Accordo italo-libico del 2000 su queste materie.",IT-Parlamento,ITA,0,9,32440.0,802.0
1592418,1592419,24/06/2015,"Comunicazioni del Presidente del Consiglio dei ministri in vista del Consiglio europeo del 25 e 26 giugno 2015 (ore 16,17) (Discussione)",196,9,3,Marietta Tidei,PD,"Va dato atto, però, al Governo di avere posto con forza la questione dell'immigrazione e delle frontiere in Europa, riuscendo a penetrare il muro di provincialismo e di piccolo interesse costruito da molti Paesi dell'Unione.",IT-Parlamento,ITA,1,19,32440.0,802.0
655018,655019,07/02/2011,"Discussione del testo unificato delle proposte di legge: Brugger e Zeller; Bernardini ed altri; Ferranti ed altri: Disposizioni a tutela del rapporto tra detenute madri e figli minori (A.C. 52-1814-2011-A) (ore 17,05). (ore 17,05). (Discussione sulle linee generali - A.C. 52-1814-2011-A)",59,8,2,Fulvio Follegot,LEGA-LN,"Fin da subito, su proposta dalla Lega Nord Padania, si è deciso di stralciare dal testo proposto le modifiche alle disposizioni riguardanti la disciplina dell'immigrazione e norme sulla condizione dello straniero, di cui al decreto legislativo 25 luglio 1998, n. 286, focalizzando l'attenzione sul rapporto tra detenute madri e figli minori.",IT-Parlamento,ITA,0,9,32720.0,1221.0
923815,923816,22/10/2013,Comunicazioni del Presidente del Consiglio dei ministri in vista del Consiglio europeo di Bruxelles del 24 e 25 ottobre 2013. (Discussione),21,7,1,Lara Ricciatti,SEL-SI,"Quanto alle politiche sull'immigrazione chiediamo al Governo di sollecitare, in sede di Consiglio europeo, un maggiore impegno di tutti gli Stati membri per il reinsediamento ovvero il trasferimento, con l'assistenza e a seguito di procedure di selezione da parte anche dell'UNHCR, di gruppi di rifugiati dai Paesi di transito o di prima accoglienza agli Stati che offrono programmi di inserimento.",IT-Parlamento,ITA,1,9,32230.0,1212.0
2354505,2354506,18/04/2019,"Discussione del Documento di economia e finanza 2019 (Doc. LVII, n. 2) (ore 13,04). (ore 13,04) (Discussione – Doc. LVII, n. 2)",49,12,2,Rebecca Frassini,LEGA-LN,"Gli impegni che stiamo mantenendo su immigrazione, lotta alla mafia, legittima difesa, legge “Fornero” e riduzione fiscale vanno nella direzione di riportare al centro il lavoro, la famiglia, la sicurezza, la tutela dell'ambiente e il futuro dei giovani, e questo lo stiamo facendo oggi in Italia e lo faremo domani in Europa (Applausi dei deputati del gruppo Fratelli d'Italia).",IT-Parlamento,ITA,1,5,32720.0,1221.0
2090025,2090026,03/08/2018,"Discussione del disegno di legge: S. 624 - Conversione in legge, con modificazioni, del decreto-legge 10 luglio 2018, n. 84, recante disposizioni urgenti per la cessione di unità navali italiane a supporto della Guardia costiera del Ministero della difesa e degli organi per la sicurezza costiera del Ministero dell'interno libici (Approvato dal Senato) (A.C. 1004) (ore 10,05). (ore 10,05) (Repliche - A.C. 1004)",66,1,3,Emanuela Rossini,MISTO,Il decreto-legge fa riferimento al contrasto all'immigrazione clandestina e illegale e volevo chiedere…,IT-Parlamento,ITA,0,9,,
1684772,1684773,26/03/2015,"Seguito della discussione del disegno di legge: Conversione in legge del decreto-legge 18 febbraio 2015, n. 7, recante misure urgenti per il contrasto del terrorismo, anche di matrice internazionale, nonché proroga delle missioni internazionali delle Forze armate e di polizia, iniziative di cooperazione allo sviluppo e sostegno ai processi di ricostruzione e partecipazione alle iniziative delle Organizzazioni internazionali per il consolidamento dei processi di pace e di stabilizzazione (A.C. 2893-A). (Esame dell'articolo unico – A.C. 2893-A/R)",209,4,1,Nicola Molteni,LEGA-LN,Qui si vede chi è a favore dell'immigrazione clandestina e chi è contro l'immigrazione clandestina.,IT-Parlamento,ITA,0,9,32720.0,1221.0
591544,591545,15/02/2011,"Informativa urgente del Governo sugli sviluppi della situazione in alcuni Paesi dell'area mediterranea (ore 16,04) (Intervento del Ministro degli affari esteri)",61,10,4,Franco Frattini,PDL,L'Unione europea ha risposto positivamente alla richiesta del presidente Berlusconi al Presidente Van Rompuy di convocare presto un Consiglio europeo straordinario sull'immigrazione e sulla situazione in nord Africa.,IT-Parlamento,ITA,1,9,32061.0,365.0
