,instance_id,date,agenda,speechnumber,paragraphnumber,sentencenumber,speaker,party,text,parliament,iso3country,eu,policyarea,cmp_party,partyfacts
459775,459776,28/04/2011,"Discussione del documento: Documento di economia e finanza 2011 (Doc. LVII n. 4) (ore 9,45). (Dichiarazioni di voto - Doc. LVII, n. 4)",104,4,1,Giorgio La Malfa,MISTO,"E infatti, se non vi sarà crescita, se il vincolo europeo sul debito pubblico che è stato introdotto e che prevede che ogni anno i Paesi che hanno un debito superiore al 60 per cento riducano la differenza di un ventesimo - il che vuol dire il 3 per cento l'anno per l'Italia, che ha il doppio del debito pubblico in rapporto al PIL rispetto al limite previsto - non verrà attenuato da una forte crescita del reddito nazionale, l'Italia sarà costretta ad una lunga, lunghissima serie di anni con politiche economiche insopportabili, onorevoli colleghi.",IT-Parlamento,ITA,1,1,,
834796,834797,21/12/2012,Seguito della discussione del disegno di legge: Disposizioni per la formazione del bilancio annuale e pluriennale dello Stato (legge di stabilità 2013) (Approvato dalla Camera e modificato dal Senato) (A.C. 5534-bis-B). bis (Dichiarazioni di voto finale - A.C. 5534-bis-B),252,4,2,Roberto Simonetti,LEGA-LN,"Ciò ha fatto sì che sia stato sforato il tetto dei 2 mila miliardi di euro di debito pubblico, un macigno che le politiche consociative degli anni Ottanta e Novanta hanno messo in capo a ogni singolo cittadino.",IT-Parlamento,ITA,0,1,32720.0,1221.0
733405,733406,12/12/2012,Si riprende la discussione del disegno di legge di conversione n. 5626. (Dichiarazioni di voto sulla questione di fiducia - Articolo unico - A.C. 5626),297,1,4,Arturo Iannaccone,Noi Sud,"È aumentata la disoccupazione, è diminuito il prodotto interno lordo, sono aumentate le tasse, è aumentato il debito pubblico.",IT-Parlamento,ITA,0,1,,2415.0
2372834,2372835,03/12/2019,"Discussione del disegno di legge: Conversione in legge del decreto-legge 26 ottobre 2019, n. 124, recante disposizioni urgenti in materia fiscale e per esigenze indifferibili (A.C. 2220-A). (Discussione sulle linee generali – A.C. 2220-A)",145,3,1,Francesco Acquaroli,FDI,"Il contribuente è forse il soggetto che in Italia ha il ruolo principale, perché noi abbiamo una spesa pubblica molto, molto elevata, e abbiamo un debito pubblico molto elevato, quindi il contribuente è il soggetto attore principale, perché consente a tutti noi e a tutte le istituzioni di poter adempiere i propri compiti a tutti i livelli.",IT-Parlamento,ITA,0,1,32630.0,2280.0
795364,795365,07/08/2012,Si riprende la discussione. (Dichiarazioni di voto finale - A.C. 5389),322,6,2,Roberto Simonetti,LEGA-LN,"E, anche in questo caso, aiuta una banca - nel dettaglio, il Monte dei Paschi di Siena che, tra l'altro, ha una connotazione politica ben precisa -, che viene salvata dallo Stato mediante un impegno di acquisto dei sui titoli per un valore di almeno 4 miliardi di euro, trovati mediante l'accensione di debito pubblico.",IT-Parlamento,ITA,0,1,32720.0,1221.0
1392234,1392235,07/08/2014,Informativa urgente del Governo sugli interventi in materia di revisione della spesa pubblica alla luce degli attuali vincoli di bilancio. (Interventi),195,3,3,Paolo Tancredi,NCD,"Lei sa benissimo che questa è una caratteristica fondamentale anche per il controllo del debito pubblico, che in questi anni è cresciuto soprattutto per colpa della diminuzione del PIL e anche per alcune partite straordinarie, ma è cresciuto con una dinamica inferiore a quella di tutti gli altri Paesi dell'area euro.",IT-Parlamento,ITA,1,1,,2052.0
2232210,2232211,18/02/2019,"Discussione della proposta di legge: S. 690 - D'iniziativa dei senatori: Patuanelli ed altri: Istituzione di una Commissione parlamentare di inchiesta sul sistema bancario e finanziario (Approvata dal Senato) (A.C. 1353); e delle abbinate proposte di legge: Zanettin ed altri; Rampelli ed altri; Ruocco ed altri; Brunetta (A.C. 654-772-793-905) (ore 14,25). (ore 14,25) (Discussione sulle linee generali – A.C. 1353)",66,1,6,Francesca Gerardi,LEGA-LN,"La Commissione non si limita a svolgere solamente i compiti appena descritti, ma accende un vero e proprio faro, inoltre, su ulteriori aspetti dell'attività bancaria, quali il sistema dei Confidi, le agenzie di rating, i sistemi di informazione creditizia, l'utilizzo degli strumenti derivati da parte degli enti pubblici e il debito pubblico, in relazione alla disciplina sulla cartolarizzazione delle sofferenze ed alla relativa garanzia statale, le fondazioni bancarie e le norme in materia di tutela del risparmio.",IT-Parlamento,ITA,0,15,32720.0,1221.0
418195,418196,15/06/2010,"Si riprende la discussione (ore 15,35) (Dichiarazioni di voto finale - A.C. 3505)",54,13,2,Renato Cambursano,IDV,"Stiamo parlando del debito pubblico ufficiale, al quale sarebbe interessante aggiungere anche quello non ufficiale, che non ci è dato di conoscere e sul quale abbiamo chiesto notizie.",IT-Parlamento,ITA,0,1,32902.0,768.0
1225698,1225699,17/04/2014,"Discussione del Documento di economia e finanza 2014 (Doc. LVII, n. 2). (Discussione – Doc. LVII, n. 2)",74,9,1,Gianni Melilla,SEL-SI,"La scelta di competere sui costi e non sullo sviluppo si trova nella modesta proiezione del tasso medio annuo di variazione della produttività, nella riduzione del costo del lavoro in termini reali e nel programmatico contenimento dell'inflazione del costo del lavoro per unità di prodotto, malgrado i tanti richiami internazionali sul rischio di deflazione con le conseguenti ricadute negative sul debito pubblico e sull'occupazione.",IT-Parlamento,ITA,0,1,32230.0,1212.0
1002778,1002779,01/10/2013,Seguito della discussione dei disegni di legge: S. 888 – Rendiconto generale dell'Amministrazione dello Stato per l'esercizio finanziario 2012 (Approvato dal Senato) (A.C. 1572) e S. 889 – Disposizioni per l'assestamento del bilancio dello Stato e dei bilanci delle Amministrazioni autonome per l'anno finanziario 2013 (Approvato dal Senato) (A.C. 1573). (Dichiarazioni di voto finale – A.C. 1572),78,2,5,Maino Marchi,PD,"Il 2012 è stato il terzo anno consecutivo di diminuzione della spesa pubblica primaria in termini nominali e, quindi, tagli veri, ma in quei tre anni il debito pubblico in rapporto al PIL è sempre cresciuto, sia con il Governo Berlusconi che con il Governo Monti, perché è fondamentale il tema della crescita, del lavoro, dell'equità nella distribuzione dei redditi, anche per la finanza pubblica.",IT-Parlamento,ITA,0,1,32440.0,802.0
424060,424061,20/07/2010,"Si riprende la discussione (ore 12,05) (Dichiarazioni di voto finale - A.C. 3593)",20,4,5,Gian Luca Galletti,UDC,"Questo carico è insopportabile, non è possibile che su questa famiglia gravi una quota di spese, di interessi, di spesa corrente e di debito pubblico così elevato.",IT-Parlamento,ITA,0,1,32610.0,201.0
439550,439551,16/11/2010,"Discussione congiunta dei disegni di legge: Disposizioni per la formazione del bilancio annuale e pluriennale dello Stato (legge di stabilità 2011) (A.C. 3778-A); Bilancio di previsione dello Stato per l'anno finanziario 2011 e per il triennio 2011-2013 (A.C. 3779-A) (ore 10,12). (Discussione congiunta sulle linee generali - A.C. 3778-A e A.C. 3779-A).",20,1,5,Renato Cambursano,IDV,"«Se la questione del debito pubblico non diventa una delle sfide chiave o la sfida principale delle prossime elezioni politiche - che ormai sono alle porte, e questo lo dico io - sarà inevitabile una crisi di proporzioni enormi.",IT-Parlamento,ITA,0,1,32902.0,768.0
770569,770570,06/12/2012,"Seguito della discussione del disegno di legge: Conversione in legge, con modificazioni, del decreto-legge 10 ottobre 2012, n. 174, recante disposizioni urgenti in materia di finanza e funzionamento degli enti territoriali, nonché ulteriori disposizioni in favore delle zone terremotate nel maggio 2012. Proroga di termine per l'esercizio di delega legislativa (Approvato dalla Camera e modificato dal Senato) (A.C. 5520-B). (Dichiarazioni di voto sulla questione di fiducia - Articolo unico - A.C. 5520-B)",18,6,4,Benedetto Della Vedova,FLI,A chi dice che lo spread è merito degli interventi della Banca centrale europea chiedo: pensate che con l'Italia di un anno fa Mario Draghi avrebbe potuto dire «compreremo illimitatamente titoli del debito pubblico di Spagna e Italia»?,IT-Parlamento,ITA,1,1,,1179.0
2381673,2381674,05/12/2019,"Seguito della discussione del disegno di legge: Conversione in legge del decreto-legge 26 ottobre 2019, n. 124, recante disposizioni urgenti in materia fiscale e per esigenze indifferibili (A.C. 2220-A/R) (Dichiarazioni di voto sulla questione di fiducia - A.C. 2220-A/R)",33,5,11,Alessandro Cattaneo,FI,Va detto che il debito pubblico galoppa anche per delle eredità che arrivano dai Governi precedenti.,IT-Parlamento,ITA,0,1,32610.0,1626.0
2201244,2201245,19/06/2018,"Discussione del Documento di economia e finanza 2018 (Doc. LVII, n. 1) (ore 9,36). (ore 9,36) (Discussione – Doc. LVII, n. 1)",60,1,2,Luigi Marattin,PD,"Paese cumulativamente in questi anni si sono ripresi quasi del 10 per cento, del 9,5; il deficit in rapporto al PIL si è dimezzato, dal 3 per cento all'1,6 previsto quest'anno, e il debito pubblico che, lo ripeto, non va misurato in valori assoluti mentre voi continuate a dire 300 miliardi, 200 miliardi, il debito in valori assoluti cresce sempre finché c'è un deficit positivo, ma il debito va misurato in rapporto al PIL e in rapporto al PIL si è stabilizzato al 131,8 per cento, anche se è un valore molto alto.",IT-Parlamento,ITA,0,1,32440.0,802.0
1405205,1405206,20/03/2014,"Discussione delle mozioni Castelli ed altri n. 1-00348, Marcon ed altri n. 1-00362, Guidesi ed altri n. 1-00363 e Giorgia Meloni ed altri n. 1-00372 concernenti lo scostamento dai parametri europei in materia di deficit pubblico (ore 11,20) (Discussione sulle linee generali)",33,7,2,Giampaolo Galli,PD,"Nessun politico è contento di votare contro emendamenti che danno delle provvidenze probabilmente utili, ma il problema è che c’è un più profondo senso di responsabilità che ha animato il voto dei deputati di maggioranza, ed è la consapevolezza che c’è un tema molto serio che è quello del debito pubblico e delle coperture.",IT-Parlamento,ITA,0,20,32440.0,802.0
2422799,2422800,11/12/2019,Si riprende la discussione. (Dichiarazioni di voto),166,1,9,Giorgia Meloni,FDI,"È ragionevole dire che non ha molto senso che noi, che ci siamo salvati da soli le nostre banche che erano esposte sul fronte dei non performing loans, senza che a nessuno interessasse, aumentando il nostro debito pubblico, che oggi dobbiamo usare i soldi degli italiani e degli europei per salvare le banche francesi e tedesche (Applausi dei deputati del gruppo Fratelli d'Italia)?",IT-Parlamento,ITA,1,1,32630.0,2280.0
1486287,1486288,10/03/2015,"Seguito della discussione del disegno di legge costituzionale: S. 1429 – Disposizioni per il superamento del bicameralismo paritario, la riduzione del numero dei parlamentari, il contenimento dei costi di funzionamento delle istituzioni, la soppressione del CNEL e la revisione del Titolo V della parte II della Costituzione (Approvato, in prima deliberazione, dal Senato) (A.C. 2613-A); e degli abbinati progetti di legge costituzionale: D'iniziativa popolare; D'iniziativa popolare; Vignali; Cirielli; Cirielli; Cirielli; Causi; Pisicchio; Pisicchio; Pisicchio; Pisicchio; Giachetti; Scotto; Francesco Sanna; Peluffo ed altri; Lenzi; Lauricella ed altri; Bressa e De Menech; Caparini ed altri; Caparini ed altri; Vaccaro; Laffranco e Bianconi; Palmizio; Palmizio; Palmizio; Palmizio; Giancarlo Giorgetti ed altri; Giancarlo Giorgetti ed altri; La Russa ed altri; Abrignani ed altri; Toninelli ed altri; Gianluca Pini; Laffranco e Bianconi; Ginefra ed altri; Giorgia Meloni ed altri; Migliore ed altri; D'iniziativa del Governo; Bonafede e Villarosa; Pierdomenico Martino; Brambilla; Giancarlo Giorgetti ed altri; Cirielli e Giorgia Meloni; Valiante; Quaranta ed altri; Lacquaniti ed altri; Civati ed altri; Bossi; Lauricella e Simoni; Dadone ed altri; Giorgis ed altri; La Russa ed altri; Rubinato ed altri; D'iniziativa del consiglio Regionale dell'Emilia-Romagna; Matteo Bragantini ed altri; Civati; Francesco Sanna ed altri (A.C. 8-14-2132-33-34-148-177-178-179-180-243-247-284-329-355-357-379-398-399-466-568-579-580-581-582-757-758-839-861-939-1002-1259-1273-1319-1439-1543-1660-1706-1748-1925-1953-2051-2147-2221-2227-2293-2329-2338-2378-2402-2423-2441-2458-2462-2499) (ore 10,05). (Dichiarazioni di voto finale – A.C. 2613-A)",20,6,1,Fabio Rampelli,FDI,"Non c’è stato consentito di introdurre il principio dell'equità generazionale, quello della partecipazione attiva dei giovani alla vita politica come se si volesse rimuovere, invece che affrontare, il problema che abbiamo dovuto constatare essersi presentato nel tempo e aver prodotto danni inenarrabili con un debito pubblico che è pari al 130 per cento del PIL ancora oggi, più o meno, come se non si volesse far passare il principio che ogni generazione deve fare i conti con le proprie tasche e la propria capacità di produrre ricchezza senza indebitare le generazioni che verranno, come se si volesse rimuovere il problema, ormai drammatico, di generazioni, giovani generazioni che avranno delle pensioni da fame in futuro, anche perché hanno una clamorosa difficoltà di accesso al mondo del lavoro.",IT-Parlamento,ITA,0,1,32630.0,2280.0
1474324,1474325,08/06/2015,"Discussione del disegno di legge: Disposizioni per l'adempimento degli obblighi derivanti dall'appartenenza dell'Italia all'Unione europea – Legge europea 2014 (A.C. 2977-A) (ore 14,08). (Discussione sulle linee generali – A.C. 2977-A)",10,2,2,Sergio Battelli,M5S,"Un'Europa dei popoli, dove la Grecia e l'Italia non siano al centro del dibattito solo quando si parla di debito pubblico, di inadempienze, di spread, ma siano i promotori del dibattito e delle politiche volte ad affrontare l'imprescindibile necessità di incrementare la produttività e la competitività delle aziende, soprattutto PMI, che sono la colonna portante del nostro Paese, come è bene ricordare sempre, e di migliorare il livello del welfare.",IT-Parlamento,ITA,1,19,32956.0,2046.0
601043,601044,26/09/2011,"Discussione del disegno di legge costituzionale: Modifiche agli articoli 41, 45, 97 e 118, comma quarto, della Costituzione (A.C. 4144-A); e delle abbinate proposte di legge costituzionale: Vignali ed altri; Vignali ed altri; Beltrandi ed altri; Mantini ed altri; (A.C. 3039-3054-3967-4328) (ore 15,02). (Discussione sulle linee generali - A.C. 4144-A)",44,3,2,Pierluigi Mantini,UDC,"Per il vero, nel Documento di economia e finanza 2011 il Governo attribuisce a queste modifiche costituzionali un rilevante significato di scossa positiva all'economia, con un eccesso davvero esagerato di ottimismo anche con riguardo agli effetti e ai tempi necessariamente lunghi delle riforme costituzionali, a fronte dell'urgenza invece di forti misure per il contenimento della spesa e del debito pubblico e per la crescita del Paese.",IT-Parlamento,ITA,0,1,32610.0,201.0
279197,279198,19/07/2010,"Discussione congiunta dei disegni di legge: Rendiconto generale dell'amministrazione dello Stato per l'esercizio finanziario 2009 (A.C. 3593) e Disposizioni per l'assestamento del bilancio dello Stato e dei bilanci delle Amministrazioni autonome per l'anno finanziario 2010 (A.C. 3594) (ore 17,10). (Discussione congiunta sulle linee generali - A.C. 3593 e A.C. 3594)",10,5,3,Maino Marchi,PD,"Per ora i fatti certificano che negli anni di Governo del centrosinistra - 1996-2001 e 2006-2007 - il debito pubblico è diminuito, mentre negli anni del Governo di centrodestra e della destra - 2001-2006 e dal 2008 ad oggi - il debito pubblico è sempre cresciuto.",IT-Parlamento,ITA,0,1,32440.0,802.0
1225442,1225443,17/04/2014,"Discussione del Documento di economia e finanza 2014 (Doc. LVII, n. 2). (Discussione – Doc. LVII, n. 2)",52,12,1,Pier Carlo Padoan,PD,"A questo fine, sottopongo alla vostra attenzione la relazione sull'indebitamento del debito pubblico contenuta nel capitolo 3 della sezione 1 del Documento di economia e finanza.",IT-Parlamento,ITA,0,1,32440.0,802.0
105708,105709,29/07/2009,"Seguito della discussione del Documento di programmazione economico-finanziaria relativo alla manovra di finanza pubblica per gli anni 2010-2013 (Doc. LVII, n. 2) (ore 9,42) (Repliche dei relatori - Doc. LVII, n. 2)",78,4,1,Massimo Bitonci,LEGA-LN,"Altra critica dei colleghi è relativa all'aumento del debito pubblico, che il Governo ha cercato di contenere, ma che è cresciuto al 115 per cento in rapporto al PIL.",IT-Parlamento,ITA,0,1,32720.0,1221.0
563670,563671,18/11/2011,Discussione sulle comunicazioni del Governo (ore 10). (Dichiarazioni di voto),158,11,2,Angelino Alfano,PDL,"È un compito decisivo, per il quale non mancherà l'apporto politico e, se mi permettete, anche tecnico delle migliori esperienze legislative e di Governo, che hanno segnato la storia degli ultimi tre anni nel campo della lotta alla criminalità organizzata, della tenuta dei conti pubblici, della impostazione della riforma fiscale, della riforma del mercato del lavoro e dell'istruzione (Applausi dei deputati del gruppo Popolo della Libertà) e di molte altre priorità e che ci hanno infine condotto alla formulazione del pareggio di bilancio per il 2013, all'avanzo primario migliore tra i nostri partner, a un tasso di disoccupazione inferiore a quello dei concorrenti e alla difesa in generale dei fondamentali di un'economia solida il cui storico sovraccarico di debito pubblico è oggi sotto forte attacco dei mercati finanziari.",IT-Parlamento,ITA,0,1,32061.0,365.0
1482132,1482133,10/09/2015,"Si riprende la discussione. (Dichiarazioni di voto – Doc. LXXXVII-bis, n. 3-A)",53,8,2,Mario Sberna,CD,"Come suggerisce, con la solita appassionata e speciale competenza, l'ex Ministro Enzo Moavero, l'Italia potrebbe tornare protagonista della nuova Europa unita rilanciando la discussione attraverso l'introduzione di un bilancio indipendente per l'Eurozona che compensi le asimmetrie tra gli Stati e incentivi riforme strutturali e investimenti che creino posti di lavoro, finanziato da entrate autonome che sostituiscano tributi nazionali simili; la facoltà di emettere titoli europei di debito pubblico per raccogliere finanziamenti e riducendo l'analoga necessità dei vari Paesi, a sollievo dei loro oberati conti e relativi interessi da pagare; l'istituzione di un Ministro europeo con competenze fiscali, di tesoreria e di spesa, che dialoghi con i Governi nazionali e con la BCE, rispondendo a rappresentanti democraticamente eletti dai cittadini, cioè i deputati europei dell'Eurozona; un sistema di accordi contrattuali che prevedano incentivi ad ogni Stato che vara le riforme richieste dalle annuali raccomandazioni del Consiglio europeo; una politica di stimolo degli investimenti favorevoli all'occupazione che potenzi il piano Juncker, innovi gli interventi della BEI, estenda l'uso del project bond, valorizzi al meglio le potenzialità di un bilancio dell'Eurozona.",IT-Parlamento,ITA,1,19,32450.0,2278.0
439829,439830,16/11/2010,"Discussione congiunta dei disegni di legge: Disposizioni per la formazione del bilancio annuale e pluriennale dello Stato (legge di stabilità 2011) (A.C. 3778-A); Bilancio di previsione dello Stato per l'anno finanziario 2011 e per il triennio 2011-2013 (A.C. 3779-A) (ore 10,12). (Discussione congiunta sulle linee generali - A.C. 3778-A e A.C. 3779-A).",38,14,2,Francesco Barbato,IDV,"Con il Governo Berlusconi si è accumulato - badate bene, signori deputati! - il 25 per cento dell'intero debito pubblico di questo",IT-Parlamento,ITA,0,1,32902.0,768.0
430666,430667,29/09/2010,Si riprende la discussione. (Replica del Presidente del Consiglio dei ministri - Posizione della questione di fiducia),150,3,6,Silvio Berlusconi,PDL,"Il debito pubblico, nella sua sostanza, è rimasto quello di prima, o con un aumento limitatissimo, ma il numeratore è aumentato come qualcuno dell'opposizione ha, con verità, ricordato.",IT-Parlamento,ITA,0,1,32061.0,365.0
622838,622839,16/12/2011,"Si riprende la discussione (ore 15,15) (Dichiarazioni di voto finale - A.C. 4829-A)",707,16,2,Marco Giovanni Reguzzoni,LEGA-LN,"Voi del PD siete come il debito pubblico: peggiorate sempre, non migliorate mai (Applausi dei deputati del gruppo Lega Nord Padania - Commenti dei deputati del gruppo Partito Democratico)!",IT-Parlamento,ITA,0,20,32720.0,1221.0
2272178,2272179,23/12/2019,Seguito della discussione del disegno di legge: S. 1586 - Bilancio di previsione dello Stato per l'anno finanziario 2020 e bilancio pluriennale per il triennio 2020-2022 (Approvato dal Senato)(A.C. 2305); Nota di variazioni al Bilancio di previsione dello Stato per l'anno finanziario 2020 e bilancio pluriennale per il triennio 2020-2022 (A.C. 2305/I). (Dichiarazioni di voto sulla questione di fiducia – Articolo 1 – A.C. 2305),38,6,10,Claudio Borghi,LEGA-LN,"Ma, scusate, a me piacerebbe che ogni tanto qualcuno facesse questa piccola riflessione: i 3 mila miliardi di debito pubblico dell'eurozona sono in questo momento custoditi nelle banche centrali e segnatamente nell'Eurosistema, quindi, sotto la responsabilità della signora Lagarde, ma se la signora Lagarde, domani, senza dire niente a nessuno…",IT-Parlamento,ITA,1,1,32720.0,1221.0
169903,169904,27/04/2009,Discussione della mozione Franceschini ed altri n. 1-00148 concernente iniziative per il contrasto della povertà e dell'emarginazione. (Discussione sulle linee generali),10,18,5,Aurelio Salvatore Misiti,IDV,"È vero che abbiamo un alto debito pubblico, le risorse sono limitate, la profonda crisi economica in atto acuisce drammaticamente le disparità sociali, ma è anche vero che non possiamo continuare a prendere ai meno ricchi e dare ai ricchi, oppure a prendere dalle zone del Paese più svantaggiate, come il Mezzogiorno, e trasferire risorse verso le zone meno svantaggiate.",IT-Parlamento,ITA,0,1,32902.0,768.0
1109931,1109932,08/07/2013,"Discussione del disegno di legge: Conversione in legge del decreto-legge 4 giugno 2013, n. 61, recante nuove disposizioni urgenti a tutela dell'ambiente, della salute e del lavoro nell'esercizio di imprese di interesse strategico nazionale (A.C. 1139-A) (ore 12,12) (Discussione sulle linee generali – A.C. 1139-A)",16,5,3,Claudia Mannino,M5S,"In quegli anni, mentre si iniziava ad alzare il «volume» di un'Unione europea, la Germania ostentava l'unità monetaria e, investendo su se stessa in termini di debito pubblico, ha unificato, rinnovato e investito sulle proprie aziende, portandole all'avanguardia, e solo dopo ha acconsentito al passaggio verso la moneta unica, su cui riversare il proprio debito pubblico.",IT-Parlamento,ITA,1,1,32956.0,2046.0
422358,422359,13/12/2010,"Discussione della mozione Franceschini, Donadi ed altri n. 1-00492, di sfiducia al Governo (ore 16,07) (Discussione sulle linee generali)",6,14,1,Enrico Letta,PD,"Oggi il debito pubblico è tornato ai livelli di allora - mi faccia dire, rispetto alla replica che ha fatto oggi al Senato, che purtroppo le sue repliche sono sempre più gustose di quando legge i suoi interventi scritti - e nemmeno nella prima Repubblica il ritmo di crescita in due anni del debito pubblico è stato pari a quello della crescita in questo biennio: 16 punti di crescita in due anni.",IT-Parlamento,ITA,0,1,32440.0,802.0
412369,412370,19/05/2010,Si riprende la discussione. (Esame degli articoli - A.C. 82-A ed abbinate),27,7,2,Fabrizio Cicchitto,PDL,"In caso contrario, ripercorreremmo delle strade che hanno portato il debito pubblico nelle condizioni nelle quali siamo.",IT-Parlamento,ITA,0,1,32061.0,365.0
804783,804784,25/01/2012,"Discussione delle mozioni Franceschini ed altri n. 1-00800, Cicchitto ed altri n. 1-00802, Cambursano e Brugger n. 1-00818, Mecacci ed altri n. 1-00821, Donadi ed altri n. 1-00822 e Antonione ed altri n. 1-00823 sulla politica europea dell'Italia. (Dichiarazioni di voto)",133,3,2,Leoluca Orlando,IDV,"La nostra posizione è di vigilanza critica e costruttiva, atto per atto, scelta per scelta, a presidio - non ci stancheremo mai di ripeterlo - dell'equità sociale per l'eliminazione di privilegi e sprechi, a presidio della crescita produttiva ed economica; un'azione, quella dell'Italia dei Valori, nelle aule parlamentari, per l'abbattimento del debito pubblico e, al tempo stesso, la lotta all'abnorme evasione e alla scandalosa corruzione.",IT-Parlamento,ITA,0,1,32902.0,768.0
422806,422807,13/12/2010,"Discussione della mozione Franceschini, Donadi ed altri n. 1-00492, di sfiducia al Governo (ore 16,07) (Discussione sulle linee generali)",71,5,2,Piero Fassino,PD,"La crisi che l'ha portata qui ha le sue radici in un debito pubblico che è cresciuto costantemente e sottolineo che, ogni qual volta governate voi, cresce, dopo che i governi di centrosinistra quel debito pubblico lo hanno ridotto (Applausi dei deputati del gruppo Partito Democratico).",IT-Parlamento,ITA,0,1,32440.0,802.0
332740,332741,26/07/2010,Si riprende la discussione. (Ripresa discussione sulle linee generali - A.C. 3638),86,4,1,Ivano Strizzolo,PD,"Siccome spesso in quest'Aula, soprattutto da parte dei colleghi della Lega Nord, si afferma che l'enorme debito pubblico è colpa dei Governi di centrosinistra degli anni Ottanta e dei primi anni Novanta, questo è vero solamente in parte; l'aumento del debito pubblico si deve anche a chi ha governato questo Paese almeno 10-11 anni degli ultimi 15-16 anni.",IT-Parlamento,ITA,0,1,32440.0,802.0
